14:55:06.482909 IP 0.0.0.0.bootpc > 255.255.255.255.bootps: BOOTP/DHCP, Request from 00:e0:4c:68:08:00 (oui Unknown), length 300
14:55:07.959671 IP 0.0.0.0.bootpc > 255.255.255.255.bootps: BOOTP/DHCP, Request from 00:19:d1:b2:4d:ad (oui Unknown), length 337
14:55:08.124544 ARP, Request who-has 10.2.28.1 tell 10.2.28.88, length 46
14:55:08.124546 ARP, Reply 10.2.28.1 is-at 00:05:00:41:ae:25 (oui Unknown), length 46
14:55:08.876793 ARP, Request who-has 10.2.28.2 tell 10.2.28.88, length 46
14:55:08.876795 ARP, Reply 10.2.28.2 is-at 14:b3:1f:2d:ce:69 (oui Unknown), length 46
14:55:08.956092 IP 10.2.28.88.64691 > 10.2.28.2.domain: 31820+ SRV? _ldap._tcp.Default-First-Site-Name._sites.dc._msdcs.mshome.net. (80)
14:55:08.956094 IP 10.2.28.88.54705 > 10.2.28.2.domain: 8973+ SRV? _ldap._tcp.Default-First-Site-Name._sites.dc._msdcs.easyas123.tech. (84)
14:55:08.956095 IP 10.2.28.88.51473 > 10.2.28.2.domain: 25333+ SRV? _ldap._tcp.Default-First-Site-Name._sites.easyas123.tech. (74)
14:55:08.956392 IP 10.2.28.2.domain > 10.2.28.88.54705: 8973* 1/0/1 SRV easyas123-dc.easyas123.tech.:389 0 100 (147)
14:55:08.956453 IP 10.2.28.2.domain > 10.2.28.88.51473: 25333* 1/0/1 SRV easyas123-dc.easyas123.tech.:389 0 100 (137)
14:55:08.956498 IP 10.2.28.88.54705 > 10.2.28.2.domain: 47805+ A? easyas123-dc.easyas123.tech. (45)
14:55:08.956799 IP 10.2.28.2.domain > 10.2.28.88.54705: 47805* 1/0/0 A 10.2.28.2 (61)
14:55:08.957109 IP 10.2.28.88.58447 > 10.2.28.2.ldap: UDP, length 223
14:55:08.957110 IP 10.2.28.88.58447 > 10.2.28.2.ldap: UDP, length 223
14:55:08.957488 IP 10.2.28.2.ldap > 10.2.28.88.58447: UDP, length 187
14:55:08.957490 IP 10.2.28.2.ldap > 10.2.28.88.58447: UDP, length 187
14:55:08.990903 IP 10.2.28.88.64691 > 10.2.28.2.domain: 31820+ SRV? _ldap._tcp.Default-First-Site-Name._sites.dc._msdcs.mshome.net. (80)
14:55:09.007370 IP 10.2.28.88.55109 > 10.2.28.2.domain: 46589+ SRV? _ldap._tcp.Default-First-Site-Name._sites.dc._msdcs.easyas123.tech. (84)
14:55:09.007372 IP 10.2.28.88.58936 > 10.2.28.2.domain: 3999+ SRV? _ldap._tcp.Default-First-Site-Name._sites.easyas123.tech. (74)
14:55:09.007571 IP 10.2.28.2.domain > 10.2.28.88.55109: 46589* 1/0/1 SRV easyas123-dc.easyas123.tech.:389 0 100 (147)
14:55:09.007573 IP 10.2.28.2.domain > 10.2.28.88.58936: 3999* 1/0/1 SRV easyas123-dc.easyas123.tech.:389 0 100 (137)
14:55:09.008707 IP 10.2.28.88.58447 > 10.2.28.2.ldap: UDP, length 223
14:55:09.008709 IP 10.2.28.88.58447 > 10.2.28.2.ldap: UDP, length 223
14:55:09.008986 IP 10.2.28.2.ldap > 10.2.28.88.58447: UDP, length 187
14:55:09.008988 IP 10.2.28.2.ldap > 10.2.28.88.58447: UDP, length 187
14:55:09.019549 IP 10.2.28.2.domain > 10.2.28.88.64691: 31820 NXDomain 0/1/0 (166)
14:55:09.019551 IP 10.2.28.88.51473 > 10.2.28.2.domain: 8032+ SRV? _ldap._tcp.dc._msdcs.mshome.net. (49)
14:55:09.059315 IP 10.2.28.88.51473 > 10.2.28.2.domain: 8032+ SRV? _ldap._tcp.dc._msdcs.mshome.net. (49)
14:55:09.059823 IP 10.2.28.88.59979 > 10.2.28.2.ldap: Flags [S], seq 2988573589, win 65535, options [mss 1460,nop,wscale 8,nop,nop,sackOK], length 0
14:55:09.059824 IP 10.2.28.2.ldap > 10.2.28.88.59979: Flags [S.], seq 1625065840, ack 2988573590, win 65535, options [mss 1460,nop,wscale 8,nop,nop,sackOK], length 0
14:55:09.060099 IP 10.2.28.88.59979 > 10.2.28.2.ldap: Flags [.], ack 1, win 255, length 0
14:55:09.061491 IP 10.2.28.88.59979 > 10.2.28.2.ldap: Flags [.], seq 1:1461, ack 1, win 255, length 1460
14:55:09.061493 IP 10.2.28.88.59979 > 10.2.28.2.ldap: Flags [P.], seq 1461:2124, ack 1, win 255, length 663
14:55:09.061495 IP 10.2.28.2.ldap > 10.2.28.88.59979: Flags [.], ack 2124, win 4100, length 0
14:55:09.063368 IP 10.2.28.2.ldap > 10.2.28.88.59979: Flags [P.], seq 1:212, ack 2124, win 4100, length 211
14:55:09.063369 IP 10.2.28.88.59979 > 10.2.28.2.ldap: Flags [P.], seq 2124:2199, ack 212, win 255, length 75
14:55:09.063624 IP 10.2.28.2.ldap > 10.2.28.88.59979: Flags [R.], seq 212, ack 2199, win 0, length 0
14:55:09.063625 IP 10.2.28.88.59979 > 10.2.28.2.ldap: Flags [F.], seq 2199, ack 212, win 255, length 0
14:55:09.063626 IP 10.2.28.2.ldap > 10.2.28.88.59979: Flags [R], seq 1625066052, win 0, length 0
14:55:09.080086 IP 10.2.28.2.domain > 10.2.28.88.51473: 8032 NXDomain 0/1/0 (135)
14:55:09.155268 IP 10.2.28.88.63775 > 10.2.28.2.domain: 50321+ A? wpad.easyas123.tech. (37)
14:55:09.155270 IP 10.2.28.88.64206 > 10.2.28.2.domain: 49984+ A? wpad.easyas123.tech. (37)
14:55:09.155466 IP 10.2.28.2.domain > 10.2.28.88.64206: 49984 NXDomain* 0/1/0 (111)
14:55:09.155467 IP 10.2.28.2.domain > 10.2.28.88.63775: 50321 NXDomain* 0/1/0 (111)
14:55:09.155756 IP 10.2.28.88.60600 > 10.2.28.2.domain: 32959+ A? wpad.mshome.net. (33)
14:55:09.155758 IP 10.2.28.88.52670 > 10.2.28.2.domain: 21800+ A? wpad.mshome.net. (33)
14:55:09.209453 IP 10.2.28.2.domain > 10.2.28.88.60600: 32959 NXDomain 0/1/0 (119)
14:55:09.209454 IP 10.2.28.2.domain > 10.2.28.88.52670: 21800 NXDomain 0/1/0 (119)
14:55:09.226536 IP 10.2.28.88.59980 > 10.2.28.2.ldap: Flags [S], seq 3763809426, win 65535, options [mss 1460,nop,wscale 8,nop,nop,sackOK], length 0
14:55:09.226538 IP 10.2.28.2.ldap > 10.2.28.88.59980: Flags [S.], seq 2821982564, ack 3763809427, win 65535, options [mss 1460,nop,wscale 8,nop,nop,sackOK], length 0
14:55:09.227301 IP 10.2.28.88.59980 > 10.2.28.2.ldap: Flags [.], ack 1, win 255, length 0
14:55:09.227302 IP 10.2.28.88.59980 > 10.2.28.2.ldap: Flags [F.], seq 1, ack 1, win 255, length 0
14:55:09.227303 IP 10.2.28.2.ldap > 10.2.28.88.59980: Flags [.], ack 2, win 4100, length 0
14:55:09.227505 IP 10.2.28.2.ldap > 10.2.28.88.59980: Flags [R.], seq 1, ack 2, win 0, length 0
14:55:09.376777 ARP, Request who-has 10.2.28.88 tell 0.0.0.0, length 46
14:55:09.586899 IP 10.2.28.88.60600 > 10.2.28.2.domain: 26880+ SRV? _ldap._tcp.Default-First-Site-Name._sites.dc._msdcs.mshome.net. (80)
14:55:09.587227 IP 10.2.28.2.domain > 10.2.28.88.60600: 26880 NXDomain 0/1/0 (166)
14:55:09.587262 IP 10.2.28.88.60600 > 10.2.28.2.domain: 21486+ SRV? _ldap._tcp.dc._msdcs.mshome.net. (49)
14:55:09.587506 IP 10.2.28.2.domain > 10.2.28.88.60600: 21486 NXDomain 0/1/0 (135)
14:55:09.691979 IP 10.2.28.88.59981 > 10.2.28.2.microsoft-ds: Flags [S], seq 2409769837, win 65535, options [mss 1460,nop,wscale 8,nop,nop,sackOK], length 0
14:55:09.691981 IP 10.2.28.2.microsoft-ds > 10.2.28.88.59981: Flags [S.], seq 3911051398, ack 2409769838, win 65535, options [mss 1460,nop,wscale 8,nop,nop,sackOK], length 0
14:55:09.692171 IP 10.2.28.88.59981 > 10.2.28.2.microsoft-ds: Flags [.], ack 1, win 255, length 0
14:55:09.692172 IP 10.2.28.88.59981 > 10.2.28.2.microsoft-ds: Flags [P.], seq 1:160, ack 1, win 255, length 159
14:55:09.693168 IP 10.2.28.2.microsoft-ds > 10.2.28.88.59981: Flags [P.], seq 1:253, ack 160, win 4099, length 252
14:55:09.693170 IP 10.2.28.88.59981 > 10.2.28.2.microsoft-ds: Flags [P.], seq 160:480, ack 253, win 255, length 320
14:55:09.693893 IP 10.2.28.2.microsoft-ds > 10.2.28.88.59981: Flags [P.], seq 253:629, ack 480, win 4098, length 376
14:55:09.694803 IP 10.2.28.88.59981 > 10.2.28.2.microsoft-ds: Flags [.], seq 480:1940, ack 629, win 253, length 1460
14:55:09.694805 IP 10.2.28.88.59981 > 10.2.28.2.microsoft-ds: Flags [.], seq 1940:3400, ack 629, win 253, length 1460
14:55:09.694911 IP 10.2.28.88.59981 > 10.2.28.2.microsoft-ds: Flags [P.], seq 3400:4205, ack 629, win 253, length 805
14:55:09.695014 IP 10.2.28.2.microsoft-ds > 10.2.28.88.59981: Flags [.], ack 4205, win 4100, length 0
14:55:09.697023 IP 10.2.28.2.microsoft-ds > 10.2.28.88.59981: Flags [P.], seq 629:890, ack 4205, win 4100, length 261
14:55:09.697250 IP 10.2.28.88.59981 > 10.2.28.2.microsoft-ds: Flags [P.], seq 4205:4349, ack 890, win 252, length 144
14:55:09.697251 IP 10.2.28.2.microsoft-ds > 10.2.28.88.59981: Flags [P.], seq 890:974, ack 4349, win 4099, length 84
14:55:09.697465 IP 10.2.28.88.59981 > 10.2.28.2.microsoft-ds: Flags [P.], seq 4349:4473, ack 974, win 252, length 124
14:55:09.697466 IP 10.2.28.88.59981 > 10.2.28.2.microsoft-ds: Flags [P.], seq 4473:4601, ack 974, win 252, length 128
14:55:09.697637 IP 10.2.28.2.microsoft-ds > 10.2.28.88.59981: Flags [.], ack 4601, win 4099, length 0
14:55:09.697638 IP 10.2.28.2.microsoft-ds > 10.2.28.88.59981: Flags [P.], seq 974:1242, ack 4601, win 4099, length 268
14:55:09.697886 IP 10.2.28.2.microsoft-ds > 10.2.28.88.59981: Flags [P.], seq 1242:1456, ack 4601, win 4099, length 214
14:55:09.697887 IP 10.2.28.88.59981 > 10.2.28.2.microsoft-ds: Flags [.], ack 1456, win 250, length 0
14:55:09.705188 IP 10.2.28.88.52670 > 10.2.28.2.domain: 12563+ A? www.msftconnecttest.com. (41)
14:55:09.732593 IP 10.2.28.88.52670 > 10.2.28.2.domain: 12563+ A? www.msftconnecttest.com. (41)
14:55:09.745412 IP 10.2.28.2.domain > 10.2.28.88.52670: 12563 5/0/0 CNAME ncsi-geo.trafficmanager.net., CNAME www.msftncsi.com.edgesuite.net., CNAME a1961.g2.akamai.net., A 23.47.50.182, A 23.47.50.185 (185)
14:55:09.745762 IP 10.2.28.88.59982 > a23-47-50-182.deploy.static.akamaitechnologies.com.http: Flags [S], seq 2128213160, win 65535, options [mss 1460,nop,wscale 8,nop,nop,sackOK], length 0
14:55:09.772065 IP a23-47-50-182.deploy.static.akamaitechnologies.com.http > 10.2.28.88.59982: Flags [S.], seq 1547228587, ack 2128213161, win 64240, options [mss 1376,nop,nop,sackOK,nop,wscale 7], length 0
14:55:09.772237 IP 10.2.28.88.59982 > a23-47-50-182.deploy.static.akamaitechnologies.com.http: Flags [.], ack 1, win 255, length 0
14:55:09.772238 IP 10.2.28.88.59982 > a23-47-50-182.deploy.static.akamaitechnologies.com.http: Flags [P.], seq 1:155, ack 1, win 255, length 154: HTTP: GET /connecttest.txt HTTP/1.1
14:55:09.818785 IP a23-47-50-182.deploy.static.akamaitechnologies.com.http > 10.2.28.88.59982: Flags [.], ack 155, win 501, length 0
14:55:09.819006 IP a23-47-50-182.deploy.static.akamaitechnologies.com.http > 10.2.28.88.59982: Flags [P.], seq 1:188, ack 155, win 501, length 187: HTTP: HTTP/1.1 200 OK
14:55:09.819007 IP a23-47-50-182.deploy.static.akamaitechnologies.com.http > 10.2.28.88.59982: Flags [F.], seq 188, ack 155, win 501, length 0
14:55:09.819008 IP 10.2.28.88.59982 > a23-47-50-182.deploy.static.akamaitechnologies.com.http: Flags [.], ack 189, win 255, length 0
14:55:09.819238 IP 10.2.28.88.59982 > a23-47-50-182.deploy.static.akamaitechnologies.com.http: Flags [F.], seq 155, ack 189, win 255, length 0
14:55:10.128803 IP 10.2.28.88.59982 > a23-47-50-182.deploy.static.akamaitechnologies.com.http: Flags [F.], seq 155, ack 189, win 255, length 0
14:55:10.173016 IP a23-47-50-182.deploy.static.akamaitechnologies.com.http > 10.2.28.88.59982: Flags [.], ack 156, win 501, length 0
14:55:10.368230 ARP, Request who-has 10.2.28.88 tell 0.0.0.0, length 46
14:55:10.602601 IP 10.2.28.88.60600 > 10.2.28.2.domain: 19815+ SRV? _ldap._tcp.Default-First-Site-Name._sites.dc._msdcs.mshome.net. (80)
14:55:10.602603 IP 10.2.28.2.domain > 10.2.28.88.60600: 19815 NXDomain 0/1/0 (166)
14:55:10.602844 IP 10.2.28.88.60600 > 10.2.28.2.domain: 6211+ SRV? _ldap._tcp.dc._msdcs.mshome.net. (49)
14:55:10.603072 IP 10.2.28.2.domain > 10.2.28.88.60600: 6211 NXDomain 0/1/0 (135)
14:55:10.702812 IP 10.2.28.88.60600 > 10.2.28.2.domain: 11714+ A? v10.events.data.microsoft.com. (47)
14:55:10.740406 IP 10.2.28.2.domain > 10.2.28.88.60600: 11714 3/0/0 CNAME win-global-asimov-leafs-events-data.trafficmanager.net., CNAME onedscolprdcus09.centralus.cloudapp.azure.com., A 13.89.179.9 (187)
14:55:10.741505 IP 10.2.28.88.59983 > 13.89.179.9.https: Flags [S], seq 655856504, win 65535, options [mss 1460,nop,wscale 8,nop,nop,sackOK], length 0
14:55:10.777113 IP 0.0.0.0.bootpc > 255.255.255.255.bootps: BOOTP/DHCP, Request from 00:19:d1:b2:4d:ad (oui Unknown), length 337
14:55:10.789094 IP 10.2.28.1.bootps > 10.2.28.88.bootpc: BOOTP/DHCP, Reply, length 307
14:55:10.804211 IP 13.89.179.9.https > 10.2.28.88.59983: Flags [S.], seq 2679907745, ack 655856505, win 65535, options [mss 1376,nop,wscale 8,nop,nop,sackOK], length 0
14:55:10.804499 IP 10.2.28.88.59983 > 13.89.179.9.https: Flags [.], ack 1, win 255, length 0
14:55:10.807064 IP 10.2.28.88.59983 > 13.89.179.9.https: Flags [P.], seq 1:213, ack 1, win 255, length 212
14:55:10.808426 IP 10.2.28.88.57052 > 224.0.0.252.5355: UDP, length 33
14:55:10.869656 IP 13.89.179.9.https > 10.2.28.88.59983: Flags [.], seq 1:1357, ack 213, win 16387, length 1356
14:55:10.869868 IP 13.89.179.9.https > 10.2.28.88.59983: Flags [.], seq 1357:2713, ack 213, win 16387, length 1356
14:55:10.870082 IP 13.89.179.9.https > 10.2.28.88.59983: Flags [.], seq 2713:4069, ack 213, win 16387, length 1356
14:55:10.870083 IP 13.89.179.9.https > 10.2.28.88.59983: Flags [P.], seq 4069:4236, ack 213, win 16387, length 167
14:55:10.870084 IP 10.2.28.88.59983 > 13.89.179.9.https: Flags [.], ack 2713, win 255, length 0
14:55:10.870314 IP 10.2.28.88.59983 > 13.89.179.9.https: Flags [.], ack 4236, win 255, length 0
14:55:10.876631 IP 10.2.28.88.59983 > 13.89.179.9.https: Flags [P.], seq 213:371, ack 4236, win 255, length 158
14:55:10.939291 IP 13.89.179.9.https > 10.2.28.88.59983: Flags [P.], seq 4236:4287, ack 371, win 16387, length 51
14:55:10.939293 IP 13.89.179.9.https > 10.2.28.88.59983: Flags [P.], seq 4287:4356, ack 371, win 16387, length 69
14:55:10.939667 IP 10.2.28.88.59983 > 13.89.179.9.https: Flags [.], ack 4356, win 255, length 0
14:55:10.944344 IP 10.2.28.88.59983 > 13.89.179.9.https: Flags [P.], seq 371:458, ack 4356, win 255, length 87
14:55:10.944346 IP 10.2.28.88.59983 > 13.89.179.9.https: Flags [P.], seq 458:1366, ack 4356, win 255, length 908
14:55:10.944347 IP 10.2.28.88.59983 > 13.89.179.9.https: Flags [P.], seq 1366:1404, ack 4356, win 255, length 38
14:55:10.945205 IP 10.2.28.88.59983 > 13.89.179.9.https: Flags [P.], seq 1404:2701, ack 4356, win 255, length 1297
14:55:11.003970 IP 13.89.179.9.https > 10.2.28.88.59983: Flags [P.], seq 4356:4394, ack 458, win 16386, length 38
14:55:11.014106 IP 13.89.179.9.https > 10.2.28.88.59983: Flags [.], ack 1404, win 16388, length 0
14:55:11.047637 IP 10.2.28.88.59983 > 13.89.179.9.https: Flags [.], ack 4394, win 255, length 0
14:55:11.060115 IP 13.89.179.9.https > 10.2.28.88.59983: Flags [.], ack 2701, win 16383, length 0
14:55:11.099184 IP 13.89.179.9.https > 10.2.28.88.59983: Flags [P.], seq 4394:4678, ack 2701, win 16383, length 284
14:55:11.108912 IP 10.2.28.88.59983 > 13.89.179.9.https: Flags [F.], seq 2701, ack 4678, win 254, length 0
14:55:11.174159 IP 13.89.179.9.https > 10.2.28.88.59983: Flags [P.], seq 4678:4720, ack 2702, win 16383, length 42
14:55:11.174303 IP 13.89.179.9.https > 10.2.28.88.59983: Flags [F.], seq 4720, ack 2702, win 16383, length 0
14:55:11.174305 IP 10.2.28.88.59983 > 13.89.179.9.https: Flags [R.], seq 2702, ack 4720, win 0, length 0
14:55:11.174307 IP 10.2.28.88.59983 > 13.89.179.9.https: Flags [R], seq 655859206, win 0, length 0
14:55:11.222096 IP 10.2.28.88.57052 > 224.0.0.252.5355: UDP, length 33
14:55:11.364622 ARP, Request who-has 10.2.28.88 tell 10.2.28.88, length 46
14:55:11.447608 IP 10.2.28.88.netbios-ns > 10.2.28.255.netbios-ns: UDP, length 68
14:55:11.447610 IP 10.2.28.88.netbios-ns > 10.2.28.255.netbios-ns: UDP, length 68
14:55:11.447827 IP 10.2.28.88.netbios-ns > 10.2.28.255.netbios-ns: UDP, length 68
14:55:11.639464 IP 10.2.28.88.60001 > 224.0.0.252.5355: UDP, length 33
14:55:12.049189 IP 10.2.28.88.60001 > 224.0.0.252.5355: UDP, length 33
14:55:12.175539 IP 10.2.28.88.52383 > 10.2.28.2.domain: 52499+ SRV? _ldap._tcp.Default-First-Site-Name._sites.dc._msdcs.mshome.net. (80)
14:55:12.175701 IP 10.2.28.2.domain > 10.2.28.88.52383: 52499 NXDomain 0/1/0 (166)
14:55:12.212760 IP 10.2.28.88.netbios-ns > 10.2.28.255.netbios-ns: UDP, length 68
14:55:12.212762 IP 10.2.28.88.netbios-ns > 10.2.28.255.netbios-ns: UDP, length 68
14:55:12.212763 IP 10.2.28.88.netbios-ns > 10.2.28.255.netbios-ns: UDP, length 68
14:55:12.697990 IP 10.2.28.88.57054 > 239.255.255.250.1900: UDP, length 137
14:55:12.857266 IP 10.2.28.88.59403 > 10.2.28.2.domain: 15710+ A? client.wns.windows.com. (40)
14:55:12.887738 IP 10.2.28.88.59403 > 10.2.28.2.domain: 15710+ A? client.wns.windows.com. (40)
14:55:12.920008 IP 10.2.28.2.domain > 10.2.28.88.59403: 15710 2/0/0 CNAME wns.notify.trafficmanager.net., A 104.208.203.89 (99)
14:55:12.920486 IP 10.2.28.88.59984 > 104.208.203.89.https: Flags [S], seq 39002051, win 65535, options [mss 1460,nop,wscale 8,nop,nop,sackOK], length 0
14:55:12.967241 IP 10.2.28.88.netbios-ns > 10.2.28.255.netbios-ns: UDP, length 68
14:55:12.967243 IP 10.2.28.88.netbios-ns > 10.2.28.255.netbios-ns: UDP, length 68
14:55:12.967245 IP 10.2.28.88.netbios-ns > 10.2.28.255.netbios-ns: UDP, length 68
14:55:12.998861 IP 104.208.203.89.https > 10.2.28.88.59984: Flags [S.], seq 3422643023, ack 39002052, win 8192, options [mss 1376,nop,wscale 0,nop,nop,sackOK], length 0
14:55:12.999094 IP 10.2.28.88.59984 > 104.208.203.89.https: Flags [.], ack 1, win 255, length 0
14:55:13.000163 IP 10.2.28.88.59984 > 104.208.203.89.https: Flags [P.], seq 1:179, ack 1, win 255, length 178
14:55:13.084371 IP 104.208.203.89.https > 10.2.28.88.59984: Flags [.], seq 1:1357, ack 179, win 8014, length 1356
14:55:13.084374 IP 104.208.203.89.https > 10.2.28.88.59984: Flags [P.], seq 1357:1461, ack 179, win 8014, length 104
14:55:13.084375 IP 10.2.28.88.59984 > 104.208.203.89.https: Flags [.], ack 1461, win 255, length 0
14:55:13.084754 IP 104.208.203.89.https > 10.2.28.88.59984: Flags [.], seq 1461:2817, ack 179, win 8014, length 1356
14:55:13.084756 IP 104.208.203.89.https > 10.2.28.88.59984: Flags [P.], seq 2817:2921, ack 179, win 8014, length 104
14:55:13.084757 IP 104.208.203.89.https > 10.2.28.88.59984: Flags [.], seq 2921:4277, ack 179, win 8014, length 1356
14:55:13.084758 IP 10.2.28.88.59984 > 104.208.203.89.https: Flags [.], ack 2921, win 255, length 0
14:55:13.084759 IP 104.208.203.89.https > 10.2.28.88.59984: Flags [P.], seq 4277:4381, ack 179, win 8014, length 104
14:55:13.085005 IP 104.208.203.89.https > 10.2.28.88.59984: Flags [.], seq 4381:5737, ack 179, win 8014, length 1356
14:55:13.085007 IP 10.2.28.88.59984 > 104.208.203.89.https: Flags [.], ack 4381, win 255, length 0
14:55:13.085008 IP 104.208.203.89.https > 10.2.28.88.59984: Flags [P.], seq 5737:5841, ack 179, win 8014, length 104
14:55:13.085009 IP 10.2.28.88.59984 > 104.208.203.89.https: Flags [.], ack 5841, win 255, length 0
14:55:13.159260 IP 104.208.203.89.https > 10.2.28.88.59984: Flags [P.], seq 5841:6229, ack 179, win 8014, length 388
14:55:13.161398 IP 10.2.28.88.59984 > 104.208.203.89.https: Flags [P.], seq 179:337, ack 6229, win 254, length 158
14:55:13.238796 IP 104.208.203.89.https > 10.2.28.88.59984: Flags [P.], seq 6229:6280, ack 337, win 7856, length 51
14:55:13.241509 IP 10.2.28.88.59984 > 104.208.203.89.https: Flags [P.], seq 337:696, ack 6280, win 254, length 359
14:55:13.241511 IP 10.2.28.88.59984 > 104.208.203.89.https: Flags [.], seq 696:2072, ack 6280, win 254, length 1376
14:55:13.241512 IP 10.2.28.88.59984 > 104.208.203.89.https: Flags [P.], seq 2072:2108, ack 6280, win 254, length 36
14:55:13.241513 IP 10.2.28.88.59984 > 104.208.203.89.https: Flags [P.], seq 2108:2354, ack 6280, win 254, length 246
14:55:13.323941 IP 104.208.203.89.https > 10.2.28.88.59984: Flags [P.], seq 6280:6559, ack 696, win 7497, length 279
14:55:13.338595 IP 104.208.203.89.https > 10.2.28.88.59984: Flags [.], ack 2072, win 8192, length 0
14:55:13.338597 IP 104.208.203.89.https > 10.2.28.88.59984: Flags [.], ack 2108, win 8156, length 0
14:55:13.338862 IP 104.208.203.89.https > 10.2.28.88.59984: Flags [P.], seq 6559:6659, ack 2108, win 8156, length 100
14:55:13.339057 IP 10.2.28.88.59984 > 104.208.203.89.https: Flags [.], ack 6659, win 252, length 0
14:55:13.343960 IP 104.208.203.89.https > 10.2.28.88.59984: Flags [P.], seq 6659:6836, ack 2354, win 7910, length 177
14:55:13.348827 IP 10.2.28.88.59984 > 104.208.203.89.https: Flags [P.], seq 2354:2573, ack 6836, win 252, length 219
14:55:13.363631 ARP, Request who-has 10.2.28.88 tell 10.2.28.88, length 46
14:55:13.430320 IP 104.208.203.89.https > 10.2.28.88.59984: Flags [P.], seq 6836:6937, ack 2573, win 7691, length 101
14:55:13.476548 IP 10.2.28.88.59984 > 104.208.203.89.https: Flags [.], ack 6937, win 251, length 0
14:55:13.758769 IP 10.2.28.88.netbios-ns > 10.2.28.255.netbios-ns: UDP, length 68
14:55:13.758770 IP 10.2.28.88.netbios-ns > 10.2.28.255.netbios-ns: UDP, length 68
14:55:13.758771 IP 10.2.28.88.netbios-ns > 10.2.28.255.netbios-ns: UDP, length 68
14:55:13.968830 IP 10.2.28.88.62053 > 10.2.28.2.domain: 15438+ SRV? _ldap._tcp.Default-First-Site-Name._sites.dc._msdcs.easyas123.tech. (84)
14:55:13.969029 IP 10.2.28.2.domain > 10.2.28.88.62053: 15438* 1/0/1 SRV easyas123-dc.easyas123.tech.:389 0 100 (147)
14:55:13.970115 IP 10.2.28.88.58447 > 10.2.28.2.ldap: UDP, length 223
14:55:13.970404 IP 10.2.28.2.ldap > 10.2.28.88.58447: UDP, length 187
14:55:14.132467 IP 10.2.28.88.58447 > 10.2.28.2.ldap: UDP, length 266
14:55:14.132668 IP 10.2.28.2.ldap > 10.2.28.88.58447: UDP, length 187
14:55:14.233723 IP 10.2.28.88.62053 > 10.2.28.2.domain: 8210+ SRV? _ldap._tcp.Default-First-Site-Name._sites.dc._msdcs.easyas123.tech. (84)
14:55:14.234002 IP 10.2.28.2.domain > 10.2.28.88.62053: 8210* 1/0/1 SRV easyas123-dc.easyas123.tech.:389 0 100 (147)
14:55:14.234515 IP 10.2.28.88.62054 > 10.2.28.2.ldap: UDP, length 223
14:55:14.234995 IP 10.2.28.2.ldap > 10.2.28.88.62054: UDP, length 187
14:55:14.336829 IP 10.2.28.88.62053 > 10.2.28.2.domain: 47345+ SRV? _ldap._tcp.Default-First-Site-Name._sites.dc._msdcs.easyas123.tech. (84)
14:55:14.336831 IP 10.2.28.2.domain > 10.2.28.88.62053: 47345* 1/0/1 SRV easyas123-dc.easyas123.tech.:389 0 100 (147)
14:55:14.337455 IP 10.2.28.88.62055 > 10.2.28.2.ldap: UDP, length 223
14:55:14.337646 IP 10.2.28.2.ldap > 10.2.28.88.62055: UDP, length 187
14:55:14.382709 IP 10.2.28.88.62053 > 10.2.28.2.domain: 55131+ A? wpad.easyas123.tech. (37)
14:55:14.382710 IP 10.2.28.88.54769 > 10.2.28.2.domain: 37363+ A? wpad.easyas123.tech. (37)
14:55:14.382711 IP 10.2.28.2.domain > 10.2.28.88.62053: 55131 NXDomain* 0/1/0 (111)
14:55:14.382900 IP 10.2.28.2.domain > 10.2.28.88.54769: 37363 NXDomain* 0/1/0 (111)
14:55:14.382902 IP 10.2.28.88.62053 > 10.2.28.2.domain: 1077+ A? wpad.mshome.net. (33)
14:55:14.382903 IP 10.2.28.88.54769 > 10.2.28.2.domain: 45041+ A? wpad.mshome.net. (33)
14:55:14.382904 IP 10.2.28.2.domain > 10.2.28.88.62053: 1077 NXDomain 0/1/0 (119)
14:55:14.383164 IP 10.2.28.2.domain > 10.2.28.88.54769: 45041 NXDomain 0/1/0 (119)
14:55:14.419228 IP 10.2.28.88.57054 > 239.255.255.250.1900: UDP, length 133
14:55:14.451273 IP 10.2.28.88.57054 > 239.255.255.250.1900: UDP, length 137
14:55:14.451841 IP 10.2.28.88.ntp > 10.2.28.2.ntp: NTPv3, Client, length 120
14:55:14.452797 IP 10.2.28.2.ntp > 10.2.28.88.ntp: NTPv3, Server, length 120
14:55:14.577606 IP 10.2.28.88.netbios-ns > 10.2.28.255.netbios-ns: UDP, length 68
14:55:15.332537 IP 10.2.28.88.netbios-ns > 10.2.28.255.netbios-ns: UDP, length 68
14:55:15.522618 ARP, Request who-has 10.2.28.88 (00:19:d1:b2:4d:ad (oui Unknown)) tell 10.2.28.2, length 46
14:55:15.522620 ARP, Reply 10.2.28.88 is-at 00:19:d1:b2:4d:ad (oui Unknown), length 46
14:55:15.698093 IP 10.2.28.88.57054 > 239.255.255.250.1900: UDP, length 137
14:55:16.117901 IP 10.2.28.88.netbios-ns > 10.2.28.255.netbios-ns: UDP, length 68
14:55:16.679469 IP 10.2.28.88.57054 > 239.255.255.250.1900: UDP, length 137
14:55:16.904480 IP 10.2.28.88.netbios-ns > 10.2.28.255.netbios-ns: UDP, length 68
14:55:17.459828 IP 10.2.28.88.57054 > 239.255.255.250.1900: UDP, length 133
14:55:17.485071 IP 10.2.28.88.57054 > 239.255.255.250.1900: UDP, length 137
14:55:17.697843 IP 10.2.28.88.netbios-dgm > 10.2.28.255.netbios-dgm: UDP, length 186
14:55:17.702482 IP 10.2.28.88.netbios-dgm > 10.2.28.255.netbios-dgm: UDP, length 201
14:55:19.197722 IP 10.2.28.88.netbios-dgm > 10.2.28.255.netbios-dgm: UDP, length 186
14:55:19.682620 IP 10.2.28.88.57054 > 239.255.255.250.1900: UDP, length 137
14:55:20.427037 IP 10.2.28.88.59981 > 10.2.28.2.microsoft-ds: Flags [P.], seq 4601:4673, ack 1456, win 250, length 72
14:55:20.427098 IP 10.2.28.2.microsoft-ds > 10.2.28.88.59981: Flags [P.], seq 1456:1528, ack 4673, win 4098, length 72
14:55:20.427970 IP 10.2.28.88.59981 > 10.2.28.2.microsoft-ds: Flags [P.], seq 4673:4745, ack 1528, win 255, length 72
14:55:20.427972 IP 10.2.28.2.microsoft-ds > 10.2.28.88.59981: Flags [P.], seq 1528:1600, ack 4745, win 4098, length 72
14:55:20.428324 IP 10.2.28.88.59981 > 10.2.28.2.microsoft-ds: Flags [R.], seq 4745, ack 1600, win 0, length 0
14:55:20.707570 IP 10.2.28.88.netbios-dgm > 10.2.28.255.netbios-dgm: UDP, length 186
14:55:22.211331 IP 10.2.28.88.netbios-dgm > 10.2.28.255.netbios-dgm: UDP, length 186
14:55:22.692112 IP 10.2.28.88.57054 > 239.255.255.250.1900: UDP, length 137
14:55:22.947512 IP 10.2.28.88.54770 > 10.2.28.2.ldap: UDP, length 223
14:55:22.947836 IP 10.2.28.2.ldap > 10.2.28.88.54770: UDP, length 187
14:55:22.955309 IP 10.2.28.88.54770 > 10.2.28.2.ldap: UDP, length 223
14:55:22.955502 IP 10.2.28.2.ldap > 10.2.28.88.54770: UDP, length 187
14:55:23.047874 IP 10.2.28.88.59985 > 10.2.28.2.kerberos: Flags [S], seq 424466381, win 65535, options [mss 1460,nop,wscale 8,nop,nop,sackOK], length 0
14:55:23.047875 IP 10.2.28.2.kerberos > 10.2.28.88.59985: Flags [S.], seq 725288745, ack 424466382, win 65535, options [mss 1460,nop,wscale 8,nop,nop,sackOK], length 0
14:55:23.048084 IP 10.2.28.88.59985 > 10.2.28.2.kerberos: Flags [.], ack 1, win 255, length 0
14:55:23.048086 IP 10.2.28.88.59985 > 10.2.28.2.kerberos: Flags [P.], seq 1:217, ack 1, win 255, length 216
14:55:23.049235 IP 10.2.28.2.kerberos > 10.2.28.88.59985: Flags [P.], seq 1:186, ack 217, win 4099, length 185
14:55:23.049237 IP 10.2.28.88.59985 > 10.2.28.2.kerberos: Flags [F.], seq 217, ack 186, win 255, length 0
14:55:23.049237 IP 10.2.28.2.kerberos > 10.2.28.88.59985: Flags [.], ack 218, win 4099, length 0
14:55:23.049471 IP 10.2.28.2.kerberos > 10.2.28.88.59985: Flags [R.], seq 186, ack 218, win 0, length 0
14:55:23.053503 IP 10.2.28.88.59986 > 10.2.28.2.kerberos: Flags [S], seq 3014285273, win 65535, options [mss 1460,nop,wscale 8,nop,nop,sackOK], length 0
14:55:23.053505 IP 10.2.28.2.kerberos > 10.2.28.88.59986: Flags [S.], seq 1582035964, ack 3014285274, win 65535, options [mss 1460,nop,wscale 8,nop,nop,sackOK], length 0
14:55:23.053506 IP 10.2.28.88.59986 > 10.2.28.2.kerberos: Flags [.], ack 1, win 255, length 0
14:55:23.053672 IP 10.2.28.88.59986 > 10.2.28.2.kerberos: Flags [P.], seq 1:297, ack 1, win 255, length 296
14:55:23.055668 IP 10.2.28.2.kerberos > 10.2.28.88.59986: Flags [.], seq 1:1461, ack 297, win 4099, length 1460
14:55:23.055670 IP 10.2.28.2.kerberos > 10.2.28.88.59986: Flags [P.], seq 1461:1665, ack 297, win 4099, length 204
14:55:23.055670 IP 10.2.28.88.59986 > 10.2.28.2.kerberos: Flags [.], ack 1665, win 255, length 0
14:55:23.055671 IP 10.2.28.88.59986 > 10.2.28.2.kerberos: Flags [F.], seq 297, ack 1665, win 255, length 0
14:55:23.055672 IP 10.2.28.2.kerberos > 10.2.28.88.59986: Flags [.], ack 298, win 4099, length 0
14:55:23.055672 IP 10.2.28.2.kerberos > 10.2.28.88.59986: Flags [R.], seq 1665, ack 298, win 0, length 0
14:55:23.055990 IP 10.2.28.88.59987 > 10.2.28.2.kerberos: Flags [S], seq 2038753477, win 65535, options [mss 1460,nop,wscale 8,nop,nop,sackOK], length 0
14:55:23.056105 IP 10.2.28.2.kerberos > 10.2.28.88.59987: Flags [S.], seq 2041094573, ack 2038753478, win 65535, options [mss 1460,nop,wscale 8,nop,nop,sackOK], length 0
14:55:23.056106 IP 10.2.28.88.59987 > 10.2.28.2.kerberos: Flags [.], ack 1, win 255, length 0
14:55:23.056723 IP 10.2.28.88.59987 > 10.2.28.2.kerberos: Flags [.], seq 1:1461, ack 1, win 255, length 1460
14:55:23.056724 IP 10.2.28.88.59987 > 10.2.28.2.kerberos: Flags [P.], seq 1461:1576, ack 1, win 255, length 115
14:55:23.056725 IP 10.2.28.2.kerberos > 10.2.28.88.59987: Flags [.], ack 1576, win 4100, length 0
14:55:23.059546 IP 10.2.28.2.kerberos > 10.2.28.88.59987: Flags [.], seq 1:1461, ack 1576, win 4100, length 1460
14:55:23.059548 IP 10.2.28.2.kerberos > 10.2.28.88.59987: Flags [P.], seq 1461:1606, ack 1576, win 4100, length 145
14:55:23.059549 IP 10.2.28.88.59987 > 10.2.28.2.kerberos: Flags [.], ack 1606, win 255, length 0
14:55:23.059550 IP 10.2.28.88.59987 > 10.2.28.2.kerberos: Flags [F.], seq 1576, ack 1606, win 255, length 0
14:55:23.059550 IP 10.2.28.2.kerberos > 10.2.28.88.59987: Flags [.], ack 1577, win 4100, length 0
14:55:23.059552 IP 10.2.28.2.kerberos > 10.2.28.88.59987: Flags [R.], seq 1606, ack 1577, win 0, length 0
14:55:23.103239 IP 10.2.28.88.54771 > 10.2.28.2.ldap: UDP, length 222
14:55:23.103241 IP 10.2.28.88.54771 > 10.2.28.2.ldap: UDP, length 223
14:55:23.103473 IP 10.2.28.2.ldap > 10.2.28.88.54771: UDP, length 187
14:55:23.103475 IP 10.2.28.2.ldap > 10.2.28.88.54771: UDP, length 187
14:55:23.218010 IP 10.2.28.88.59988 > 10.2.28.2.microsoft-ds: Flags [S], seq 2376651349, win 65535, options [mss 1460,nop,wscale 8,nop,nop,sackOK], length 0
14:55:23.218012 IP 10.2.28.2.microsoft-ds > 10.2.28.88.59988: Flags [S.], seq 3574717783, ack 2376651350, win 65535, options [mss 1460,nop,wscale 8,nop,nop,sackOK], length 0
14:55:23.218144 IP 10.2.28.88.59988 > 10.2.28.2.microsoft-ds: Flags [.], ack 1, win 255, length 0
14:55:23.218146 IP 10.2.28.88.59988 > 10.2.28.2.microsoft-ds: Flags [P.], seq 1:160, ack 1, win 255, length 159
14:55:23.219105 IP 10.2.28.2.microsoft-ds > 10.2.28.88.59988: Flags [P.], seq 1:253, ack 160, win 4099, length 252
14:55:23.219107 IP 10.2.28.88.59988 > 10.2.28.2.microsoft-ds: Flags [P.], seq 160:480, ack 253, win 255, length 320
14:55:23.219963 IP 10.2.28.2.microsoft-ds > 10.2.28.88.59988: Flags [P.], seq 253:629, ack 480, win 4098, length 376
14:55:23.224673 IP 10.2.28.88.59989 > 10.2.28.2.kerberos: Flags [S], seq 2376323874, win 65535, options [mss 1460,nop,wscale 8,nop,nop,sackOK], length 0
14:55:23.224675 IP 10.2.28.2.kerberos > 10.2.28.88.59989: Flags [S.], seq 1907930196, ack 2376323875, win 65535, options [mss 1460,nop,wscale 8,nop,nop,sackOK], length 0
14:55:23.224676 IP 10.2.28.88.59989 > 10.2.28.2.kerberos: Flags [.], ack 1, win 255, length 0
14:55:23.225014 IP 10.2.28.88.59989 > 10.2.28.2.kerberos: Flags [.], seq 1:1461, ack 1, win 255, length 1460
14:55:23.225017 IP 10.2.28.88.59989 > 10.2.28.2.kerberos: Flags [P.], seq 1461:1765, ack 1, win 255, length 304
14:55:23.225018 IP 10.2.28.2.kerberos > 10.2.28.88.59989: Flags [.], ack 1765, win 4100, length 0
14:55:23.228462 IP 10.2.28.2.kerberos > 10.2.28.88.59989: Flags [.], seq 1:1461, ack 1765, win 4100, length 1460
14:55:23.228464 IP 10.2.28.2.kerberos > 10.2.28.88.59989: Flags [P.], seq 1461:1740, ack 1765, win 4100, length 279
14:55:23.228466 IP 10.2.28.88.59989 > 10.2.28.2.kerberos: Flags [.], ack 1740, win 255, length 0
14:55:23.228467 IP 10.2.28.88.59989 > 10.2.28.2.kerberos: Flags [F.], seq 1765, ack 1740, win 255, length 0
14:55:23.228468 IP 10.2.28.2.kerberos > 10.2.28.88.59989: Flags [.], ack 1766, win 4100, length 0
14:55:23.228468 IP 10.2.28.88.59990 > 10.2.28.2.kerberos: Flags [S], seq 2067249, win 65535, options [mss 1460,nop,wscale 8,nop,nop,sackOK], length 0
14:55:23.228470 IP 10.2.28.2.kerberos > 10.2.28.88.59989: Flags [R.], seq 1740, ack 1766, win 0, length 0
14:55:23.228605 IP 10.2.28.2.kerberos > 10.2.28.88.59990: Flags [S.], seq 3414216444, ack 2067250, win 65535, options [mss 1460,nop,wscale 8,nop,nop,sackOK], length 0
14:55:23.228606 IP 10.2.28.88.59990 > 10.2.28.2.kerberos: Flags [.], ack 1, win 255, length 0
14:55:23.228919 IP 10.2.28.88.59990 > 10.2.28.2.kerberos: Flags [.], seq 1:1461, ack 1, win 255, length 1460
14:55:23.228922 IP 10.2.28.88.59990 > 10.2.28.2.kerberos: Flags [P.], seq 1461:1533, ack 1, win 255, length 72
14:55:23.228923 IP 10.2.28.2.kerberos > 10.2.28.88.59990: Flags [.], ack 1533, win 4100, length 0
14:55:23.230610 IP 10.2.28.2.kerberos > 10.2.28.88.59990: Flags [.], seq 1:1461, ack 1533, win 4100, length 1460
14:55:23.230612 IP 10.2.28.2.kerberos > 10.2.28.88.59990: Flags [P.], seq 1461:1561, ack 1533, win 4100, length 100
14:55:23.230614 IP 10.2.28.88.59990 > 10.2.28.2.kerberos: Flags [.], ack 1561, win 255, length 0
14:55:23.230615 IP 10.2.28.88.59990 > 10.2.28.2.kerberos: Flags [F.], seq 1533, ack 1561, win 255, length 0
14:55:23.230616 IP 10.2.28.2.kerberos > 10.2.28.88.59990: Flags [.], ack 1534, win 4100, length 0
14:55:23.230617 IP 10.2.28.2.kerberos > 10.2.28.88.59990: Flags [R.], seq 1561, ack 1534, win 0, length 0
14:55:23.230883 IP 10.2.28.88.59988 > 10.2.28.2.microsoft-ds: Flags [.], seq 480:1940, ack 629, win 253, length 1460
14:55:23.230961 IP 10.2.28.88.59988 > 10.2.28.2.microsoft-ds: Flags [.], seq 1940:3400, ack 629, win 253, length 1460
14:55:23.230963 IP 10.2.28.88.59988 > 10.2.28.2.microsoft-ds: Flags [P.], seq 3400:4031, ack 629, win 253, length 631
14:55:23.230965 IP 10.2.28.2.microsoft-ds > 10.2.28.88.59988: Flags [.], ack 3400, win 4100, length 0
14:55:23.233067 IP 10.2.28.2.microsoft-ds > 10.2.28.88.59988: Flags [P.], seq 629:890, ack 4031, win 4098, length 261
14:55:23.233069 IP 10.2.28.88.59988 > 10.2.28.2.microsoft-ds: Flags [P.], seq 4031:4175, ack 890, win 252, length 144
14:55:23.233311 IP 10.2.28.2.microsoft-ds > 10.2.28.88.59988: Flags [P.], seq 890:974, ack 4175, win 4097, length 84
14:55:23.233382 IP 10.2.28.88.59988 > 10.2.28.2.microsoft-ds: Flags [P.], seq 4175:4299, ack 974, win 252, length 124
14:55:23.233383 IP 10.2.28.88.59988 > 10.2.28.2.microsoft-ds: Flags [P.], seq 4299:4431, ack 974, win 252, length 132
14:55:23.233559 IP 10.2.28.2.microsoft-ds > 10.2.28.88.59988: Flags [.], ack 4431, win 4096, length 0
14:55:23.233799 IP 10.2.28.2.microsoft-ds > 10.2.28.88.59988: Flags [P.], seq 974:1242, ack 4431, win 4096, length 268
14:55:23.233801 IP 10.2.28.2.microsoft-ds > 10.2.28.88.59988: Flags [P.], seq 1242:1398, ack 4431, win 4096, length 156
14:55:23.233802 IP 10.2.28.88.59988 > 10.2.28.2.microsoft-ds: Flags [.], ack 1398, win 250, length 0
14:55:23.234076 IP 10.2.28.88.59988 > 10.2.28.2.microsoft-ds: Flags [P.], seq 4431:4539, ack 1398, win 250, length 108
14:55:23.234078 IP 10.2.28.2.microsoft-ds > 10.2.28.88.59988: Flags [P.], seq 1398:1498, ack 4539, win 4096, length 100
14:55:23.234324 IP 10.2.28.88.59988 > 10.2.28.2.microsoft-ds: Flags [P.], seq 4539:4815, ack 1498, win 255, length 276
14:55:23.234326 IP 10.2.28.2.microsoft-ds > 10.2.28.88.59988: Flags [P.], seq 1498:1582, ack 4815, win 4095, length 84
14:55:23.234505 IP 10.2.28.88.59988 > 10.2.28.2.microsoft-ds: Flags [P.], seq 4815:4932, ack 1582, win 255, length 117
14:55:23.234763 IP 10.2.28.2.microsoft-ds > 10.2.28.88.59988: Flags [P.], seq 1582:1782, ack 4932, win 4100, length 200
14:55:23.234777 IP 10.2.28.88.59988 > 10.2.28.2.microsoft-ds: Flags [P.], seq 4932:5192, ack 1782, win 254, length 260
14:55:23.235196 IP 10.2.28.2.microsoft-ds > 10.2.28.88.59988: Flags [P.], seq 1782:1962, ack 5192, win 4099, length 180
14:55:23.235198 IP 10.2.28.88.59988 > 10.2.28.2.microsoft-ds: Flags [P.], seq 5192:5368, ack 1962, win 254, length 176
14:55:23.235484 IP 10.2.28.2.microsoft-ds > 10.2.28.88.59988: Flags [P.], seq 1962:2286, ack 5368, win 4098, length 324
14:55:23.235696 IP 10.2.28.88.59988 > 10.2.28.2.microsoft-ds: Flags [P.], seq 5368:5598, ack 2286, win 252, length 230
14:55:23.235771 IP 10.2.28.2.microsoft-ds > 10.2.28.88.59988: Flags [P.], seq 2286:2470, ack 5598, win 4097, length 184
14:55:23.235772 IP 10.2.28.88.59988 > 10.2.28.2.microsoft-ds: Flags [P.], seq 5598:5802, ack 2470, win 252, length 204
14:55:23.236212 IP 10.2.28.2.microsoft-ds > 10.2.28.88.59988: Flags [P.], seq 2470:2634, ack 5802, win 4097, length 164
14:55:23.236214 IP 10.2.28.88.59988 > 10.2.28.2.microsoft-ds: Flags [P.], seq 5802:5994, ack 2634, win 251, length 192
14:55:23.236601 IP 10.2.28.2.microsoft-ds > 10.2.28.88.59988: Flags [P.], seq 2634:2798, ack 5994, win 4096, length 164
14:55:23.236602 IP 10.2.28.88.59988 > 10.2.28.2.microsoft-ds: Flags [P.], seq 5994:6240, ack 2798, win 250, length 246
14:55:23.237014 IP 10.2.28.2.microsoft-ds > 10.2.28.88.59988: Flags [P.], seq 2798:3002, ack 6240, win 4095, length 204
14:55:23.237015 IP 10.2.28.88.59988 > 10.2.28.2.microsoft-ds: Flags [P.], seq 6240:6416, ack 3002, win 255, length 176
14:55:23.237478 IP 10.2.28.2.microsoft-ds > 10.2.28.88.59988: Flags [P.], seq 3002:3166, ack 6416, win 4100, length 164
14:55:23.237479 IP 10.2.28.88.59988 > 10.2.28.2.microsoft-ds: Flags [P.], seq 6416:6588, ack 3166, win 255, length 172
14:55:23.237995 IP 10.2.28.2.microsoft-ds > 10.2.28.88.59988: Flags [P.], seq 3166:3974, ack 6588, win 4099, length 808
14:55:23.237997 IP 10.2.28.88.59988 > 10.2.28.2.microsoft-ds: Flags [P.], seq 6588:6760, ack 3974, win 252, length 172
14:55:23.238451 IP 10.2.28.2.microsoft-ds > 10.2.28.88.59988: Flags [P.], seq 3974:4338, ack 6760, win 4099, length 364
14:55:23.238453 IP 10.2.28.88.59988 > 10.2.28.2.microsoft-ds: Flags [P.], seq 6760:6928, ack 4338, win 250, length 168
14:55:23.238834 IP 10.2.28.2.microsoft-ds > 10.2.28.88.59988: Flags [P.], seq 4338:4522, ack 6928, win 4098, length 184
14:55:23.238835 IP 10.2.28.88.59988 > 10.2.28.2.microsoft-ds: Flags [P.], seq 6928:7216, ack 4522, win 255, length 288
14:55:23.239232 IP 10.2.28.2.microsoft-ds > 10.2.28.88.59988: Flags [P.], seq 4522:4694, ack 7216, win 4097, length 172
14:55:23.239233 IP 10.2.28.88.59988 > 10.2.28.2.microsoft-ds: Flags [P.], seq 7216:7384, ack 4694, win 255, length 168
14:55:23.239466 IP 10.2.28.2.microsoft-ds > 10.2.28.88.59988: Flags [P.], seq 4694:4858, ack 7384, win 4096, length 164
14:55:23.239467 IP 10.2.28.88.59988 > 10.2.28.2.microsoft-ds: Flags [P.], seq 7384:7552, ack 4858, win 254, length 168
14:55:23.239848 IP 10.2.28.2.microsoft-ds > 10.2.28.88.59988: Flags [P.], seq 4858:5022, ack 7552, win 4096, length 164
14:55:23.239849 IP 10.2.28.88.59988 > 10.2.28.2.microsoft-ds: Flags [P.], seq 7552:7720, ack 5022, win 254, length 168
14:55:23.240150 IP 10.2.28.2.microsoft-ds > 10.2.28.88.59988: Flags [P.], seq 5022:5186, ack 7720, win 4095, length 164
14:55:23.240151 IP 10.2.28.88.59988 > 10.2.28.2.microsoft-ds: Flags [P.], seq 7720:7888, ack 5186, win 253, length 168
14:55:23.240489 IP 10.2.28.2.microsoft-ds > 10.2.28.88.59988: Flags [P.], seq 5186:5350, ack 7888, win 4100, length 164
14:55:23.240555 IP 10.2.28.88.59988 > 10.2.28.2.microsoft-ds: Flags [P.], seq 7888:7980, ack 5350, win 252, length 92
14:55:23.240588 IP 10.2.28.2.microsoft-ds > 10.2.28.88.59988: Flags [P.], seq 5350:5478, ack 7980, win 4100, length 128
14:55:23.293024 IP 10.2.28.88.59991 > 10.2.28.2.microsoft-ds: Flags [S], seq 622250686, win 65535, options [mss 1460,nop,wscale 8,nop,nop,sackOK], length 0
14:55:23.293026 IP 10.2.28.2.microsoft-ds > 10.2.28.88.59991: Flags [S.], seq 2923326560, ack 622250687, win 65535, options [mss 1460,nop,wscale 8,nop,nop,sackOK], length 0
14:55:23.293027 IP 10.2.28.88.59991 > 10.2.28.2.microsoft-ds: Flags [.], ack 1, win 255, length 0
14:55:23.293265 IP 10.2.28.88.59991 > 10.2.28.2.microsoft-ds: Flags [P.], seq 1:289, ack 1, win 255, length 288
14:55:23.293469 IP 10.2.28.2.microsoft-ds > 10.2.28.88.59991: Flags [P.], seq 1:377, ack 289, win 4099, length 376
14:55:23.294196 IP 10.2.28.88.59992 > 10.2.28.2.kerberos: Flags [S], seq 4283456913, win 65535, options [mss 1460,nop,wscale 8,nop,nop,sackOK], length 0
14:55:23.294198 IP 10.2.28.2.kerberos > 10.2.28.88.59992: Flags [S.], seq 1880466274, ack 4283456914, win 65535, options [mss 1460,nop,wscale 8,nop,nop,sackOK], length 0
14:55:23.294274 IP 10.2.28.88.59992 > 10.2.28.2.kerberos: Flags [.], ack 1, win 255, length 0
14:55:23.294600 IP 10.2.28.88.59992 > 10.2.28.2.kerberos: Flags [.], seq 1:1461, ack 1, win 255, length 1460
14:55:23.294602 IP 10.2.28.88.59992 > 10.2.28.2.kerberos: Flags [P.], seq 1461:1750, ack 1, win 255, length 289
14:55:23.294603 IP 10.2.28.2.kerberos > 10.2.28.88.59992: Flags [.], ack 1750, win 4100, length 0
14:55:23.295721 IP 10.2.28.88.59988 > 10.2.28.2.microsoft-ds: Flags [.], ack 5478, win 252, length 0
14:55:23.296073 IP 10.2.28.2.kerberos > 10.2.28.88.59992: Flags [.], seq 1:1461, ack 1750, win 4100, length 1460
